{
  "schema_version": 2,
  "source_document": "FloorplanTest-02.FCStd",
  "exported_utc": "2026-09-14T18:55:54+00:00",
  "units": "meters",
  "north_axis_deg": 45.0,
  "stories": [
    {
      "name": "Level 1",
      "elevation_m": 0.0,
      "floor_to_floor_m": 3.38,
      "source_sketch": "Sketch",
      "spaces": [
        {
          "id": "5340660b-cccd-4c0d-b2e2-e6c2b2462bd6",
          "room_number": "101",
          "name": "Lobby Reception",
          "area_m2": 53.4929,
          "vertices": [
            [4.404279, 3.861179],
            [4.404279, 0.0],
            [16.383901, 0.0],
            [16.383901, 5.441071],
            [11.802944, 5.441071],
            [11.802944, 3.861179]
          ],
          "height_m": 6.09,
          "solid": {
            "source": "roof-extend",
            "roof_object": "Pad001",
            "surfaces": [
              {
                "type": "Wall",
                "vertices": [
                  [4.404279, 3.861179, 0.0],
                  [4.404279, 0.0, 0.0],
                  [4.404279, 0.0, 6.851784],
                  [4.404279, 3.861179, 6.69093]
                ]
              },
              {
                "type": "Floor",
                "vertices": [
                  [4.404279, 0.0, 0.0],
                  [4.404279, 3.861179, 0.0],
                  [11.802944, 3.861179, 0.0],
                  [11.802944, 5.441071, 0.0],
                  [16.383901, 5.441071, 0.0],
                  [16.383901, 0.0, 0.0]
                ]
              },
              {
                "type": "Wall",
                "vertices": [
                  [4.404279, 0.0, 0.0],
                  [16.383901, 0.0, 0.0],
                  [16.383901, 0.0, 6.851784],
                  [4.404279, 0.0, 6.851784]
                ]
              },
              {
                "type": "RoofCeiling",
                "vertices": [
                  [4.404279, 0.0, 6.851784],
                  [16.383901, 0.0, 6.851784],
                  [16.383901, 5.441071, 6.625113],
                  [11.802944, 5.441071, 6.625113],
                  [11.802944, 3.861179, 6.69093],
                  [4.404279, 3.861179, 6.69093]
                ]
              },
              {
                "type": "Wall",
                "vertices": [
                  [11.802944, 3.861179, 0.0],
                  [4.404279, 3.861179, 0.0],
                  [4.404279, 3.861179, 6.69093],
                  [11.802944, 3.861179, 6.69093]
                ]
              },
              {
                "type": "Wall",
                "vertices": [
                  [16.383901, 0.0, 0.0],
                  [16.383901, 5.441071, 0.0],
                  [16.383901, 5.441071, 6.625113],
                  [16.383901, 0.0, 6.851784]
                ]
              },
              {
                "type": "Wall",
                "vertices": [
                  [16.383901, 5.441071, 0.0],
                  [11.802944, 5.441071, 0.0],
                  [11.802944, 5.441071, 6.625113],
                  [16.383901, 5.441071, 6.625113]
                ]
              },
              {
                "type": "Wall",
                "vertices": [
                  [11.802944, 5.441071, 0.0],
                  [11.802944, 3.861179, 0.0],
                  [11.802944, 3.861179, 6.69093],
                  [11.802944, 5.441071, 6.625113]
                ]
              }
            ]
          }
        },
        {
          "id": "e8482312-3933-450a-aade-a047dbbd4853",
          "room_number": "101a",
          "name": "Hallway",
          "area_m2": 14.1438,
          "vertices": [
            [4.404279, 3.861179],
            [6.052994, 3.861179],
            [6.052994, 12.439874],
            [4.404279, 12.439874]
          ]
        },
        {
          "id": "0ba89e4b-8299-42af-846d-c5ba1bc7e824",
          "room_number": "101b",
          "name": "Hallway 6",
          "area_m2": 24.8939,
          "vertices": [
            [0.0, 14.139546],
            [0.0, 12.439874],
            [14.646272, 12.439874],
            [14.646272, 14.139546]
          ]
        },
        {
          "id": "aa8235a1-0856-465d-9009-e7f2de5f68e2",
          "room_number": "101c",
          "name": "Hallway",
          "area_m2": 15.1147,
          "vertices": [
            [14.646272, 5.441071],
            [16.383901, 5.441071],
            [16.383901, 14.139546],
            [14.646272, 14.139546]
          ],
          "height_m": 6.09,
          "solid": {
            "source": "roof-extend",
            "roof_object": "Pad001",
            "surfaces": [
              {
                "type": "Wall",
                "vertices": [
                  [14.646272, 5.441071, 0.0],
                  [16.383901, 5.441071, 0.0],
                  [16.383901, 5.441071, 6.625113],
                  [14.646272, 5.441071, 6.625113]
                ]
              },
              {
                "type": "Floor",
                "vertices": [
                  [16.383901, 5.441071, 0.0],
                  [14.646272, 5.441071, 0.0],
                  [14.646272, 14.139546, 0.0],
                  [16.383901, 14.139546, 0.0]
                ]
              },
              {
                "type": "Wall",
                "vertices": [
                  [16.383901, 5.441071, 0.0],
                  [16.383901, 14.139546, 0.0],
                  [16.383901, 14.139546, 6.262742],
                  [16.383901, 5.441071, 6.625113]
                ]
              },
              {
                "type": "RoofCeiling",
                "vertices": [
                  [16.383901, 5.441071, 6.625113],
                  [16.383901, 14.139546, 6.262742],
                  [14.646272, 14.139546, 6.262742],
                  [14.646272, 5.441071, 6.625113]
                ]
              },
              {
                "type": "Wall",
                "vertices": [
                  [14.646272, 14.139546, 0.0],
                  [14.646272, 5.441071, 0.0],
                  [14.646272, 5.441071, 6.625113],
                  [14.646272, 14.139546, 6.262742]
                ]
              },
              {
                "type": "Wall",
                "vertices": [
                  [16.383901, 14.139546, 0.0],
                  [14.646272, 14.139546, 0.0],
                  [14.646272, 14.139546, 6.262742],
                  [16.383901, 14.139546, 6.262742]
                ]
              }
            ]
          }
        },
        {
          "id": "3267b984-3c76-427d-81ef-33dfad8b9b6d",
          "room_number": "101d",
          "name": "Open Stair",
          "area_m2": 9.0843,
          "vertices": [
            [6.052994, 5.441071],
            [6.052994, 3.861179],
            [11.802944, 3.861179],
            [11.802944, 5.441071]
          ]
        },
        {
          "id": "fa41b8ef-e05f-4de9-8212-80f959b2f1e2",
          "room_number": "102",
          "name": "Office",
          "area_m2": 22.6901,
          "vertices": [
            [0.0, 5.151837],
            [0.0, 0.0],
            [4.404279, 0.0],
            [4.404279, 5.151837]
          ]
        },
        {
          "id": "057eb967-1176-4af8-b140-5afe239fa68b",
          "room_number": "103",
          "name": "Office",
          "area_m2": 17.5784,
          "vertices": [
            [0.0, 9.143048],
            [0.0, 5.151837],
            [4.404279, 5.151837],
            [4.404279, 9.143048]
          ]
        },
        {
          "id": "dfb2d9f2-9718-477d-b392-9e0fa34228c6",
          "room_number": "104",
          "name": "Office",
          "area_m2": 14.5201,
          "vertices": [
            [0.0, 12.439874],
            [0.0, 9.143048],
            [4.404279, 9.143048],
            [4.404279, 12.439874]
          ]
        },
        {
          "id": "781119c2-dea8-41f2-b346-46f24a127cdd",
          "room_number": "105",
          "name": "Office",
          "area_m2": 18.2356,
          "vertices": [
            [0.0, 18.286096],
            [0.0, 14.139546],
            [4.39777, 14.139546],
            [4.39777, 18.286096]
          ]
        },
        {
          "id": "bc6ea742-c352-4ea0-b1a2-6af500ad33af",
          "room_number": "106",
          "name": "Office",
          "area_m2": 17.824,
          "vertices": [
            [4.39777, 18.286096],
            [4.39777, 14.139546],
            [8.696293, 14.139546],
            [8.696293, 18.286096]
          ]
        },
        {
          "id": "40d506c0-e2fa-4641-899a-c21c3a3b1348",
          "room_number": "107",
          "name": "Office",
          "area_m2": 31.877,
          "vertices": [
            [16.383901, 14.139546],
            [16.383901, 18.286096],
            [8.696293, 18.286096],
            [8.696293, 14.139546]
          ]
        },
        {
          "id": "901d5ff2-15ae-43e4-9499-7f371844a23f",
          "room_number": "108",
          "name": "Conference",
          "area_m2": 23.3878,
          "vertices": [
            [6.052994, 9.26597],
            [6.052994, 5.441071],
            [12.167605, 5.441071],
            [12.167605, 9.26597]
          ]
        },
        {
          "id": "25224d92-3858-44e1-8487-d26d4874df64",
          "room_number": "109",
          "name": "Break Room",
          "area_m2": 19.4072,
          "vertices": [
            [6.052994, 12.439874],
            [6.052994, 9.26597],
            [12.167605, 9.26597],
            [12.167605, 12.439874]
          ]
        },
        {
          "id": "757c469f-2ef3-47c6-b7e6-14fd89ef61b3",
          "room_number": "110",
          "name": "RR",
          "area_m2": 5.6069,
          "vertices": [
            [12.167605, 10.177831],
            [14.646272, 10.177831],
            [14.646272, 12.439874],
            [12.167605, 12.439874]
          ]
        },
        {
          "id": "34472dc0-642d-4e26-ad45-954b440178bb",
          "room_number": "111",